{"action_outcome":"SUCCESS","durable_state":"TERMINAL","head_receipt_id":"sha256:1111111111111111111111111111111111111111111111111111111111111111","head_receipt_sha256":"sha256:2222222222222222222222222222222222222222222222222222222222222222","head_sequence":18,"release_identity_id":"sha256:3d52af3a2bc6eb185a48465c8680d988a57f7fecf668313673ded1aaed3a59ab","schema":"dpone.release-controller-terminal-assert-response.v1","schema_version":1,"sentinel_status":"RELEASED","tag":"v0.74.0"}